num_dossier,nom_site,date_creasite,adresse,quartier,secteur,commune,ev_tabac,ev_proprietaire,nb_acces,ev_fermable,ev_typologie,nb_arbres,acces_pmr
MNTP_000249,Abords Villas bio-climatiques,19860101.0,Rue de Sicile,Nord-Ouest,Les Hauts de Massane,Montpellier,Non,Commune,0.0,Non,4. Acc. d'habitations,0.0,Non
MNTP_000474,Place de Marathon,19910901.0,Place de Marathon,Centre,Antigone,Montpellier,Non,Commune,1.0,Oui,1. Parcs et squares,26.0,Oui
MNTP_000759,Serres - Jardin didactique,19940601.0,Avenue Albert Einstein,Est,Grammont,Montpellier,Non,Commune,1.0,Oui,18. Etablissement horticole,0.0,Non
MNTP_000856,Abords Rue Douanier Rousseau,19980910.0,Rue Douanier Rousseau,Nord-Ouest,Les Hauts de Massane,Montpellier,Non,3M,0.0,Non,2. Acc. de voiries,4.0,Non
MNTP_000145,École maternelle Madeleine Renaud,19700101.0,Avenue de Barcelone,Nord-Ouest,Mosson,Montpellier,Non,Commune,3.0,Non,6. Espaces verts écoles et crèches,8.0,Oui
MNTP_001353,Abords Quai Laurens,20240101.0,Quai Laurens,Centre,Antigone,Montpellier,Non,3M,0.0,Non,2. Acc. de voiries,18.0,Non
MNTP_000398,Escaliers Avenue de Palavas,19700101.0,Avenue de Palavas,Sud,Prés d'Arènes,Montpellier,Non,3M,0.0,Non,2. Acc. de voiries,0.0,Non
MNTP_000360,École maternelle Rudyard Kipling,19700101.0,Avenue Saint-Clément,Nord-Ouest,Cévennes,Montpellier,Non,Commune,1.0,Non,6. Espaces verts écoles et crèches,0.0,Oui
MNTP_000648,Abords Rue de la Chênaie,19910301.0,Rue de la Chênaie,Nord-Ouest,Hôpitaux - Facultés,Montpellier,Non,3M,0.0,Non,2. Acc. de voiries,2.0,Non
MNTP_000874,Abords du Château d'eau de Massane,19990928.0,Rue de la Soulane,Nord-Ouest,Les Hauts de Massane,Montpellier,Non,3M,0.0,Non,3. Acc. de bât. et équipements publics,0.0,Non
MNTP_000149,Mail du Mas de Perrette,19870101.0,Route de Lavérune,Nord-Ouest,Cévennes,Montpellier,Non,Commune,5.0,Non,1. Parcs et squares,64.0,Oui
MNTP_001333,Abords Allée Laurent Duviols,19870101.0,Allée Laurent Duviols,Sud,Croix d'Argent,Montpellier,Non,3M,0.0,Non,2. Acc. de voiries,0.0,Non
MNTP_000336,École maternelle Jacques Prévert,19700101.0,Avenue du Comté de Nice,Nord-Ouest,Les Hauts de Massane,Montpellier,Non,Commune,2.0,Non,6. Espaces verts écoles et crèches,0.0,Oui
MNTP_001224,Abords Avenue de Toulouse,19870101.0,Avenue de Toulouse - Allée Laurent Duviols,Sud,Croix d'Argent,Montpellier,Non,3M,0.0,Non,2. Acc. de voiries,0.0,Non
MNTP_001318,Abords parking du Bois de Montmaur,19910701.0,Avenue du Val de Montferrand,Nord-Ouest,Hôpitaux - Facultés,Montpellier,Non,Commune,0.0,Non,3. Acc. de bât. et équipements publics,0.0,Non
MNTP_000463,Abords Maison Pour Tous Ricôme,19000101.0,Allée Louis Bonfils,Centre,Peyrou,Montpellier,Non,Commune,0.0,Non,4. Acc. d'habitations,0.0,Non
MNTP_000788,Aqueduc Saint-Clément - Parc Clémentville,19960615.0,Allée Fragonard,Nord-Ouest,Cévennes,Montpellier,Non,Commune,4.0,Non,9. Espaces de nature,0.0,Non
MNTP_000473,École élémentaire Périclès,19870101.0,528 Boulevard d'Antigone,Centre,Antigone,Montpellier,Non,Commune,1.0,Non,6. Espaces verts écoles et crèches,0.0,Oui
MNTP_001291,ZAE Garosud - Rue Claude Balbastre,20160104.0,Rue Claude Balbastre,Sud,Croix d'Argent,Montpellier,Non,SA3M,0.0,Non,2. Acc. de voiries,0.0,Non
MNTP_001270,École primaire Benoîte Groult,20190901.0,Rue de Puech Villa,Nord-Ouest,Hôpitaux - Facultés,Montpellier,Non,Commune,2.0,Oui,6. Espaces verts écoles et crèches,14.0,Oui
MNTP_000141,Place de Tibériade,19890401.0,Place de Tibériade,Sud,Prés d'Arènes,Montpellier,Non,Commune,0.0,Non,1. Parcs et squares,24.0,Oui
MNTP_001137,Aqueduc Saint-Clément - section Saint-Priest,20120830.0,Rue Ada,Nord-Ouest,Hôpitaux - Facultés,Montpellier,Non,Commune,2.0,Non,9. Espaces de nature,0.0,En partie
MNTP_000829,ZAE Garosud - Abords et Rond-point du Mas d'Astre,19930101.0,Rond-point du Mas d'Astre,Sud,Croix d'Argent,Montpellier,Non,3M,0.0,Non,2. Acc. de voiries,18.0,Non
MNTP_000842,Square des Cétoines,19980224.0,Rue des Cétoines,Nord-Ouest,Hôpitaux - Facultés,Montpellier,Non,SA3M,0.0,Non,1. Parcs et squares,30.0,Oui
MNTP_001299,ZAE Garosud Nord - Rue Mehdi Ben Barka,20160105.0,Rue Mehdi Ben Barka,Sud,Croix d'Argent,Montpellier,Non,3M,0.0,Non,2. Acc. de voiries,0.0,Non
MNTP_000642,Abord Rue des Chasseurs - Avenue de Toulouse,19920601.0,Rue des Chasseurs - Avenue de Toulouse,Sud,Croix d'Argent,Montpellier,Non,3M,0.0,Non,2. Acc. de voiries,1.0,Non
MNTP_000168,Place Molière,19870101.0,Boulevard Victor Hugo,Centre,Écusson,Montpellier,Non,3M,0.0,Non,2. Acc. de voiries,0.0,Non
MNTP_001334,Abords Rue Charles Gounod,20230101.0,Rue Charles Gounod,Sud,Croix d'Argent,Montpellier,Non,3M,0.0,Non,4. Acc. d'habitations,3.0,Non
MNTP_001209,Abords Rue Léon Trotski,20160101.0,Rue Léon Trotski,Sud,Croix d'Argent,Montpellier,Non,3M,0.0,Non,2. Acc. de voiries,34.0,Non
MNTP_001098,Tram Ligne 2 - Abords Rue Jules Ferry,20070601.0,Rue Jules Ferry,Centre,Écusson,Montpellier,Non,3M,0.0,Non,2. Acc. de voiries,10.0,Non
MNTP_001321,ZAE Garosud - Rond-point Henri Rol-Tanguy,19930101.0,Rond-Point Henri Rol-Tanguy,Sud,Croix d'Argent,Montpellier,Non,3M,0.0,Non,2. Acc. de voiries,10.0,Non
MNTP_002564,Cheminement Fès Malbosc,20241030.0,Rue de Malbosc,Nord-Ouest,Hôpitaux - Facultés,Montpellier,Non,3M,0.0,Non,2. Acc. de voiries,0.0,Non
MNTP_001093,Abords Rue Orphée,20060704.0,Rue Orphée,Nord-Ouest,Cévennes,Montpellier,Non,3M,0.0,Non,2. Acc. de voiries,0.0,Non
MNTP_001169,Ilot Avenue de Lodève,20140904.0,Avenue de Lodève,Centre,Peyrou,Montpellier,Non,3M,0.0,Non,2. Acc. de voiries,0.0,Non
MNTP_000176,Abords parking Rue Jaufre Rudel,19720101.0,Rue Jaufre Rudel,Nord-Ouest,Les Hauts de Massane,Montpellier,Non,3M,0.0,Non,2. Acc. de voiries,8.0,Non
MNTP_000358,École maternelle Jeanne Deroin,19700101.0,Rue Viollet le Duc,Nord-Ouest,Cévennes,Montpellier,Non,Commune,1.0,Non,6. Espaces verts écoles et crèches,4.0,Oui
MNTP_000312,Domaine de Grammont - Abords Avenue Albert Einstein,19000101.0,Avenue Albert Einstein,Est,Grammont,Montpellier,Non,Commune,2.0,Non,2. Acc. de voiries,0.0,Non
MNTP_000727,Abords École primaire Ludwig-Van-Beethoven,19931115.0,Chemin de Poutingon,Sud,Croix d'Argent,Montpellier,Non,Commune,0.0,Non,6. Espaces verts écoles et crèches,0.0,Oui
MNTP_000153,École maternelle Geneviève Bon,19700101.0,Rue Paul Rimbaud,Nord-Ouest,Cévennes,Montpellier,Non,Commune,1.0,Non,6. Espaces verts écoles et crèches,13.0,Oui
MNTP_000241,Abords parking Rue Bertrand de Born,19720101.0,Rue Bertrand de Born,Nord-Ouest,Les Hauts de Massane,Montpellier,Non,3M,0.0,Non,2. Acc. de voiries,8.0,Non
MNTP_000864,Abords Jardins du Séminaire,19980904.0,Rue des Communautés,Nord-Ouest,Mosson,Montpellier,Non,3M,0.0,Non,2. Acc. de voiries,0.0,Non
MNTP_000267,Abords Route de Lavérune - Est,19880101.0,Route de Lavérune,Nord-Ouest,Cévennes,Montpellier,Non,3M,0.0,Non,2. Acc. de voiries,22.0,Non
MNTP_001001,Abord Rue des Bateliers,20041130.0,Rue des Bateliers - Rue des Éclusiers,Sud,Prés d'Arènes,Montpellier,Non,3M,0.0,Non,2. Acc. de voiries,5.0,Non
MNTP_000507,Abords Rue des Bouisses - Sud,19901101.0,Rue des Bouisses,Nord-Ouest,Cévennes,Montpellier,Non,3M,0.0,Non,2. Acc. de voiries,2.0,Non
MNTP_000116,Ilots Ancienne mairie,19720101.0,Rue du Jeu de Ballon,Centre,Antigone,Montpellier,Non,Commune,0.0,Non,3. Acc. de bât. et équipements publics,1.0,Non
MNTP_000764,Abords Maison Pour Tous André Chamson,19941118.0,Rue Gustave Eiffel,Nord-Ouest,Cévennes,Montpellier,Non,Commune,2.0,Non,6. Espaces verts écoles et crèches,0.0,Oui
MNTP_001284,Domaine de Grammont - Roseraie,19850101.0,Avenue Albert Einstein,Est,Grammont,Montpellier,Non,3M,0.0,Non,3. Acc. de bât. et équipements publics,0.0,Non
MNTP_000214,École maternelle Térésa,19700101.0,Rue Antoine-Laurent Jussieu,Nord-Ouest,Hôpitaux - Facultés,Montpellier,Non,Commune,1.0,Non,6. Espaces verts écoles et crèches,8.0,Oui
MNTP_001183,Parc Montcalm - Résidences CROUS,20141107.0,Rue des Chasseurs,Sud,Croix d'Argent,Montpellier,Non,Commune,3.0,Oui,1. Parcs et squares,115.0,Oui
MNTP_000049,Square des Arceaux,19480101.0,Boulevard Benjamin Milhaud,Centre,Peyrou,Montpellier,Oui,Commune,2.0,Oui,1. Parcs et squares,0.0,Oui
MNTP_000050,Square Figuerolles,19920301.0,Rue du Faubourg Figuerolles,Centre,Peyrou,Montpellier,Non,Commune,0.0,Non,1. Parcs et squares,42.0,Non
MNTP_000950,Square Louis Boffet,20011126.0,Rue Lallemand,Centre,Écusson,Montpellier,Non,Commune,1.0,Oui,1. Parcs et squares,8.0,Oui
MNTP_000479,École maternelle Agrippa d'Aubigné,19700101.0,Rue des Quatre Seigneurs,Nord-Ouest,Hôpitaux - Facultés,Montpellier,Non,Commune,3.0,Non,6. Espaces verts écoles et crèches,23.0,Oui
MNTP_000254,Parc Bel Juel,19650101.0,Avenue des Moulins,Nord-Ouest,Cévennes,Montpellier,Non,Commune,1.0,Oui,1. Parcs et squares,0.0,Oui
MNTP_000182,Ilot Rue des Azéroliers,19880101.0,Rue des Azéroliers,Nord-Ouest,Cévennes,Montpellier,Non,3M,0.0,Non,2. Acc. de voiries,0.0,Non
MNTP_000697,Ilots Rue du Jeu de Mail des Abbés,19930726.0,Rue du Jeu de Mail des Abbés,Centre,Verdanson,Montpellier,Non,Commune,0.0,Non,2. Acc. de voiries,0.0,Non
MNTP_000483,École maternelle Louise Michel,19700101.0,Avenue de la Pompignane,Est,Port Marianne,Montpellier,Non,Commune,1.0,Non,6. Espaces verts écoles et crèches,12.0,Oui
MNTP_000189,Abords Rue Placentin,19780101.0,Rue Placentin,Centre,Écusson,Montpellier,Non,3M,0.0,Non,2. Acc. de voiries,0.0,Non
MNTP_000095,Square des Prés d'Arènes,19870101.0,Avenue de Palavas,Sud,Prés d'Arènes,Montpellier,Non,Commune,4.0,Oui,1. Parcs et squares,7.0,En partie
MNTP_002536,Abords Rue Georges Denizot,19000101.0,Rue Georges Denizot,Nord-Ouest,Hôpitaux - Facultés,Montpellier,Non,3M,0.0,Non,2. Acc. de voiries,0.0,Non
MNTP_000965,Parc Dioscoride,20030215.0,Esplanade de Celleneuve - Allée de Paris,Nord-Ouest,Mosson,Montpellier,Oui,Commune,4.0,Oui,1. Parcs et squares,0.0,Oui
MNTP_000725,Parc de Costebelle,17500101.0,Allée Louis Mazas,Est,Port Marianne,Montpellier,Non,Commune,1.0,Oui,1. Parcs et squares,13.0,Non
MNTP_000376,Ilot Moularès/Trinquat,19000101.0,Chemin de Moularès,Sud,Prés d'Arènes,Montpellier,Non,Commune,1.0,Oui,2. Acc. de voiries,0.0,Non
MNTP_000280,Parc de Bagatelle,18500101.0,Rue de Cheng Du,Sud,Croix d'Argent,Montpellier,Non,Commune,4.0,Oui,1. Parcs et squares,91.0,Oui
MNTP_000797,Place Trégaro,19960115.0,Place Louis et Marie Trégaro,Est,Port Marianne,Montpellier,Non,Commune,2.0,Non,12. Place,14.0,Oui
MNTP_001089,Abords Rue de la Roqueturière,19950101.0,Rue de la Roqueturière,Nord-Ouest,Hôpitaux - Facultés,Montpellier,Non,3M,0.0,Non,2. Acc. de voiries,0.0,Non
MNTP_000805,Abords Allée Germain Boffrand,19950315.0,Allée Germain Boffrand,Nord-Ouest,Mosson,Montpellier,Non,Commune,0.0,Non,4. Acc. d'habitations,7.0,Non
MNTP_000016,Parc Sainte Odile,19770101.0,Route de Mende,Centre,Verdanson,Montpellier,Non,Commune,4.0,Oui,1. Parcs et squares,43.0,Oui
MNTP_002527,Parc Georges Charpak,19970101.0,Avenue Raymond Dugrand,Est,Port Marianne,Montpellier,Non,Commune,6.0,Non,1. Parcs et squares,0.0,Oui
MNTP_001212,ZAE Garosud - Rue de la Jasse de Maurin,20160105.0,Rue de la Jasse de Maurin,Sud,Croix d'Argent,Montpellier,Non,3M,0.0,Non,2. Acc. de voiries,39.0,Non
MNTP_001078,Berges du Rieucoulon - Plantations,20080416.0,Rue Rouget de Lisle - Pas du Loup - Sichuan - Cheng Du - Rte de Lavérune,Sud,Croix d'Argent,Montpellier,Non,Commune,0.0,Non,9. Espaces de nature,0.0,Non
MNTP_001294,Abords Rue du Mas de Villaret,20010101.0,Rue du Mas de Villaret,Sud,Croix d'Argent,Montpellier,Non,3M,0.0,Non,2. Acc. de voiries,0.0,Non
MNTP_000024,Multi accueil L'Oustal dou Caganis,19000101.0,Rue des Razeteurs,Sud,Prés d'Arènes,Montpellier,Non,Commune,1.0,Oui,3. Acc. de bât. et équipements publics,0.0,Oui
MNTP_000266,Abords Cuisine centrale,19850101.0,Route de Lavérune,Nord-Ouest,Cévennes,Montpellier,Non,3M,0.0,Non,3. Acc. de bât. et équipements publics,0.0,Non
MNTP_001200,Toiture terrasse Central Park,20130101.0,Place Georges Frêche,Sud,Prés d'Arènes,Montpellier,Non,Commune,1.0,Oui,19. Espaces verts autres,15.0,Non
MNTP_000020,Parc des Pastourelles,18500101.0,Rue Jules Isaac,Est,Port Marianne,Montpellier,Oui,Commune,3.0,Oui,1. Parcs et squares,118.0,Oui
MNTP_000902,Abords Rue des Impressionnistes,20000401.0,Rue des Impressionnistes,Nord-Ouest,Hôpitaux - Facultés,Montpellier,Non,3M,0.0,Non,2. Acc. de voiries,6.0,Non
MNTP_000373,Abords parking Chemin de la Fontaine du Roy,19900101.0,Chemin de la Fontaine du Roy,Nord-Ouest,Mosson,Montpellier,Non,Commune,0.0,Non,5. Acc. de zones indus. et commerciales,0.0,Non
MNTP_000588,Abords Rue de la Sardane,19920130.0,Rue de la Sardane,Sud,Croix d'Argent,Montpellier,Non,3M,0.0,Non,2. Acc. de voiries,2.0,Non
MNTP_000603,Abords parking du zoo de Lunaret,19910701.0,Avenue du Val de Montferrand,Nord-Ouest,Hôpitaux - Facultés,Montpellier,Non,Commune,0.0,Non,3. Acc. de bât. et équipements publics,0.0,Non
MNTP_001166,Tram Ligne 3 - Rue de Clémentville,20140903.0,Rue de Clémentville,Nord-Ouest,Cévennes,Montpellier,Non,3M,0.0,Non,2. Acc. de voiries,0.0,Non
MNTP_000007,Parc Petit bois de la Colline,19830101.0,Rue de la Croix de Figuerolles,Nord-Ouest,Cévennes,Montpellier,Non,Commune,4.0,Non,10. Bassins de rétention,0.0,En partie
MNTP_002533,Abords Rue du Mas de Nègre - Nord,20000101.0,Rue du Mas de Nègre,Sud,Croix d'Argent,Montpellier,Non,SA3M,0.0,Non,2. Acc. de voiries,0.0,Non
MNTP_000092,Ilot Place du Gévaudan,19720101.0,Place du Gévaudan,Nord-Ouest,Les Hauts de Massane,Montpellier,Non,3M,0.0,Non,2. Acc. de voiries,0.0,Non
MNTP_000270,Abords Avenue de la Liberté - Ouest,19760101.0,Avenue de la Liberté,Nord-Ouest,Cévennes,Montpellier,Non,3M,0.0,Non,2. Acc. de voiries,0.0,Non
MNTP_001091,Tram Ligne 2 - Abords Allée Alegria Beracasa,20070601.0,Allée Alegria Beracasa,Centre,Antigone,Montpellier,Non,3M,0.0,Non,2. Acc. de voiries,0.0,Non
MNTP_000859,Ilots Avenue Raymond Dugrand - Faculté Richter,19980901.0,Avenue Raymond Dugrand,Est,Port Marianne,Montpellier,Non,3M,0.0,Non,2. Acc. de voiries,0.0,Non
MNTP_000848,Abords Allée des Castors du Midi - Rue William et Catherine Booth,19980428.0,Allée des Castors du Midi - Rue William et Catherine Booth,Sud,Croix d'Argent,Montpellier,Non,3M,0.0,Non,4. Acc. d'habitations,3.0,Non
MNTP_001072,Abords Odysseum,19000101.0,Boulevard Pénélope / Boulevard Télémaque,Est,Port Marianne,Montpellier,Non,SA3M,0.0,Non,2. Acc. de voiries,437.0,Non
MNTP_000684,École élémentaire Ronsard,20230101.0,694 Rue Jacques Bounin,Sud,Croix d'Argent,Montpellier,Non,Commune,2.0,Oui,6. Espaces verts écoles et crèches,4.0,Oui
MNTP_000824,Abords salle Avicenne,19970515.0,Avenue Paul Bringuier,Nord-Ouest,Cévennes,Montpellier,Non,Commune,0.0,Non,3. Acc. de bât. et équipements publics,3.0,Non
MNTP_000401,École élémentaire Jacques Brel,20240901.0,5 Impasse des Marmousets,Sud,Prés d'Arènes,Montpellier,Non,Commune,2.0,Oui,6. Espaces verts écoles et crèches,11.0,Oui
MNTP_000136,Tour de la Babotte,19850101.0,Boulevard Victor Hugo,Centre,Écusson,Montpellier,Non,Commune,0.0,Non,3. Acc. de bât. et équipements publics,4.0,Non
MNTP_000893,Abords Avenue du Colonel Pavelet,19991115.0,Avenue du Colonel Pavelet,Sud,Croix d'Argent,Montpellier,Non,3M,0.0,Non,2. Acc. de voiries,96.0,Non
MNTP_001205,Ilot échangeur sud Prés d'Arènes,20151105.0,Echangeur Montpellier sud,Sud,Prés d'Arènes,Montpellier,Non,3M,0.0,Non,2. Acc. de voiries,0.0,Non
MNTP_002559,Ilots Avenue du Professeur Étienne Antonelli,20240101.0,Avenue du Professeur Étienne Antonelli,Sud,Prés d'Arènes,Montpellier,Non,3M,0.0,Non,2. Acc. de voiries,0.0,Non
MNTP_000861,Abords Rue de Navacelles,19961226.0,Rue de Navacelles,Nord-Ouest,Hôpitaux - Facultés,Montpellier,Non,3M,0.0,Non,2. Acc. de voiries,0.0,Non
MNTP_002545,Abords Rue du Pilory,20050711.0,Rue du Pilory,Nord-Ouest,Mosson,Montpellier,Non,3M,0.0,Non,2. Acc. de voiries,0.0,Non
MNTP_000644,Abords Quai Louis le Vau,19910301.0,Quai Louis le Vau,Nord-Ouest,Mosson,Montpellier,Non,Commune,0.0,Non,4. Acc. d'habitations,27.0,Non
MNTP_002540,Parc Montcalm - CROUS,20110101.0,Rue des Chasseurs,Sud,Croix d'Argent,Montpellier,Non,Commune,1.0,Oui,1. Parcs et squares,0.0,Non
MNTP_000665,Abords Rue Hippolyte Fizeau,19920601.0,Rue Hippolyte Fizeau,Est,Port Marianne,Montpellier,Non,3M,0.0,Non,4. Acc. d'habitations,46.0,Non
MNTP_000532,Domaine de Méric - Privé,18620101.0,Rue de Ferran,Nord-Ouest,Hôpitaux - Facultés,Montpellier,Non,Commune,1.0,Oui,1. Parcs et squares,0.0,En partie
MNTP_000036,Square Louisville,19820101.0,Avenue de Louisville,Nord-Ouest,Mosson,Montpellier,Non,Commune,0.0,Non,1. Parcs et squares,0.0,Oui
MNTP_000331,Abords Allée de Corfou,19880101.0,Allée de Corfou,Centre,Antigone,Montpellier,Non,Commune,0.0,Non,4. Acc. d'habitations,8.0,Non
MNTP_000359,École élémentaire Baruch Spinoza,20240901.0,Rue Viollet le Duc,Nord-Ouest,Cévennes,Montpellier,Non,Commune,1.0,Non,6. Espaces verts écoles et crèches,2.0,Oui
MNTP_000966,Abords Rond-point Odette Branger Capion,20030102.0,Rue du Faubourg Boutonnet,Centre,Verdanson,Montpellier,Non,3M,0.0,Non,2. Acc. de voiries,8.0,Non
MNTP_000958,Abords ACM Alexender Bell,19950315.0,Rue Léonard de Vinci,Est,Port Marianne,Montpellier,Non,Commune,0.0,Non,4. Acc. d'habitations,0.0,Non
MNTP_000701,Place Roger Salengro,20221031.0,Place Roger Salengro,Centre,Peyrou,Montpellier,Non,Commune,0.0,Non,2. Acc. de voiries,6.0,Oui
MNTP_000032,Maison Pour Tous Marie Curie,19250101.0,Allée Pierre Carabasse,Nord-Ouest,Mosson,Montpellier,Non,Commune,1.0,Non,1. Parcs et squares,92.0,Oui
MNTP_000640,Halte garderie Mary Poppins,19880101.0,Parc Tastavin,Sud,Croix d'Argent,Montpellier,Non,Commune,1.0,Non,6. Espaces verts écoles et crèches,2.0,Oui
MNTP_000244,Abords parking Rue Pierre d'Auvergne,19720101.0,Rue Pierre d'Auvergne,Nord-Ouest,Les Hauts de Massane,Montpellier,Non,3M,0.0,Non,2. Acc. de voiries,10.0,Non
MNTP_000502,Abords Rue Eurydice,19910301.0,Rue Eurydice,Nord-Ouest,Cévennes,Montpellier,Non,3M,0.0,Non,2. Acc. de voiries,13.0,Non
MNTP_002541,Abord Rue des Myrtes,20240401.0,Rue des Myrtes,Nord-Ouest,Cévennes,Montpellier,Non,3M,0.0,Non,2. Acc. de voiries,0.0,Non
MNTP_000111,Place Faulquier,19870101.0,Place Faulquier,Centre,Antigone,Montpellier,Non,Commune,0.0,Non,2. Acc. de voiries,10.0,Non
MNTP_000972,Parc de la Mogère,20240123.0,Route de Vauguières,Est,Port Marianne,Montpellier,Non,Commune,3.0,Non,1. Parcs et squares,83.0,Oui
MNTP_001147,Abords Allée Alberto Giacometti,19970101.0,Allée Alberto Giacometti,Est,Port Marianne,Montpellier,Non,SA3M,2.0,Non,2. Acc. de voiries,66.0,Non
MNTP_000820,Abords Allée du Comté de Foix,19961001.0,Allée du Comté de Foix,Nord-Ouest,Les Hauts de Massane,Montpellier,Non,3M,0.0,Non,2. Acc. de voiries,0.0,Non
MNTP_001099,Ilot Rue Martin Luther King,20090911.0,Rue Martin Luther King,Nord-Ouest,Cévennes,Montpellier,Non,3M,0.0,Non,2. Acc. de voiries,0.0,Non
MNTP_001138,Abords Chemin des Barques,20100301.0,Chemin des Barques,Est,Port Marianne,Montpellier,Non,3M,0.0,Non,2. Acc. de voiries,23.0,Non
MNTP_000924,Ilot Impasse des Briquetiers,20010101.0,Impasse des Briquetiers,Nord-Ouest,Cévennes,Montpellier,Non,3M,0.0,Non,2. Acc. de voiries,0.0,Non
MNTP_000349,École maternelle Miguel de Cervantes,19700101.0,Rue Charles Bonaparte,Nord-Ouest,Mosson,Montpellier,Non,Commune,1.0,Non,6. Espaces verts écoles et crèches,4.0,Oui
MNTP_000361,École élémentaire Charles Baudelaire,19700101.0,Avenue Saint-Clément,Nord-Ouest,Cévennes,Montpellier,Non,Commune,2.0,Non,6. Espaces verts écoles et crèches,0.0,Oui
MNTP_002551,Abords Avenue des Dragées,20240624.0,Avenue des Dragées,Sud,Croix d'Argent,Montpellier,Non,3M,0.0,Non,2. Acc. de voiries,14.0,Non
MNTP_000803,Abords du Parnasse,19960115.0,Avenue de la Pompignane,Est,Port Marianne,Montpellier,Non,Commune,0.0,Non,2. Acc. de voiries,19.0,Non
MNTP_000420,Ilot Rue du Grenache,19900101.0,Rue du Grenache,Nord-Ouest,Cévennes,Montpellier,Non,3M,0.0,Non,2. Acc. de voiries,0.0,Non
MNTP_001304,Abords Rue du Caducée,19900501.0,Rue du Caducée,Nord-Ouest,Hôpitaux - Facultés,Montpellier,Non,3M,0.0,Non,2. Acc. de voiries,0.0,Non
MNTP_001306,Tram Ligne 1 - Abords Avenue Émile Bertin-Sans,20001006.0,Avenue Émile Bertin-Sans,Nord-Ouest,Hôpitaux - Facultés,Montpellier,Non,3M,0.0,Non,2. Acc. de voiries,0.0,Non
MNTP_001005,Berges du Lez - Abords Château le Lez,20010115.0,Rue de Sémalen,Centre,Antigone,Montpellier,Non,Commune,0.0,Non,4. Acc. d'habitations,33.0,Oui
MNTP_000841,Abords Jardins des ormes,19980112.0,Rue de Mourèze,Nord-Ouest,Cévennes,Montpellier,Non,3M,0.0,Non,2. Acc. de voiries,11.0,Non
MNTP_001065,Abords Rue Judith Restnick,20071204.0,Rue Judith Restnick,Nord-Ouest,Cévennes,Montpellier,Non,Commune,0.0,Non,2. Acc. de voiries,0.0,Non
MNTP_001066,Rond-point de Thèbes,19910901.0,Rue de Thèbes,Centre,Antigone,Montpellier,Non,Commune,0.0,Non,2. Acc. de voiries,4.0,Non
MNTP_000094,Place du Minervois,19720101.0,Place du Minervois,Nord-Ouest,Les Hauts de Massane,Montpellier,Non,3M,0.0,Non,2. Acc. de voiries,11.0,Non
MNTP_001187,Abords Route de Vauguières,20141126.0,Route de Vauguières,Est,Port Marianne,Montpellier,Non,3M,0.0,Non,2. Acc. de voiries,0.0,Non
MNTP_000089,Les Clolus 3,19650101.0,Rue Cyrano de Bergerac,Nord-Ouest,Hôpitaux - Facultés,Montpellier,Non,Commune,0.0,Non,1. Parcs et squares,0.0,Non
MNTP_000996,Parc René Dumont,20220101.0,Boulevard Vieussens,Centre,Peyrou,Montpellier,Non,Région,3.0,Oui,1. Parcs et squares,0.0,Oui
MNTP_000969,Transparence Lez-Lironde,20030301.0,Avenue de Boirargues,Est,Port Marianne,Montpellier,Non,Commune,0.0,Non,9. Espaces de nature,0.0,Non
MNTP_000171,École maternelle Virginia Woolf,19700101.0,Rue de Bari,Nord-Ouest,Les Hauts de Massane,Montpellier,Non,Commune,1.0,Non,6. Espaces verts écoles et crèches,0.0,Oui
MNTP_000134,Place Gallot,19890101.0,Avenue de l'École d'Agriculture Gabriel Buchet,Centre,Peyrou,Montpellier,Non,Commune,0.0,Non,2. Acc. de voiries,2.0,Non
MNTP_000083,Promenade du Peyrou,17740101.0,Rue la Blottière,Centre,Peyrou,Montpellier,Non,Commune,4.0,Oui,1. Parcs et squares,269.0,Oui
MNTP_000691,Abords Avenue François Delmas,19950615.0,Avenue François Delmas,Centre,Verdanson,Montpellier,Non,3M,0.0,Non,2. Acc. de voiries,21.0,Non
MNTP_000952,Abords Rue de la Marquerose,20010601.0,Rue de la Marquerose,Sud,Croix d'Argent,Montpellier,Non,3M,0.0,Non,2. Acc. de voiries,0.0,Non
MNTP_000993,Ilot Impasse de la Pointe Vigne,20040826.0,Impasse de la Pointe Vigne,Nord-Ouest,Cévennes,Montpellier,Non,3M,0.0,Non,2. Acc. de voiries,0.0,Non
MNTP_000144,Square Maquis Bir-hakeim,18580101.0,Boulevard Benjamin Milhaud,Centre,Peyrou,Montpellier,Non,Commune,5.0,Oui,1. Parcs et squares,35.0,Oui
MNTP_000891,Square du Soleil Levant,20000522.0,Avenue du Comté de Nice,Nord-Ouest,Les Hauts de Massane,Montpellier,Non,Commune,0.0,Non,1. Parcs et squares,0.0,En partie
MNTP_000338,École élémentaire André Boulloche,20210901.0,Rue de Bari,Nord-Ouest,Les Hauts de Massane,Montpellier,Non,Commune,2.0,Non,6. Espaces verts écoles et crèches,8.0,Oui
MNTP_000968,Place Henri Krasucki,20030101.0,Place Henri Krasucki,Centre,Verdanson,Montpellier,Non,3M,0.0,Non,2. Acc. de voiries,8.0,Oui
MNTP_000807,École élémentaire Joseph Delteil,19940915.0,Rue des Araucarias,Nord-Ouest,Cévennes,Montpellier,Non,Commune,1.0,Non,6. Espaces verts écoles et crèches,0.0,Oui
MNTP_000886,Ilot Impasse Edmond,20000117.0,Impasse Edmond,Nord-Ouest,Cévennes,Montpellier,Non,3M,0.0,Non,2. Acc. de voiries,0.0,Non
MNTP_000303,Square Rue de l'Améthyste,19890101.0,Rue de l'Améthyste,Sud,Prés d'Arènes,Montpellier,Non,Commune,1.0,Oui,1. Parcs et squares,5.0,En partie
MNTP_000540,Aménagements ZAC Croix Argent,19930101.0,Allée J. Barrandon - Rue B. Blier - Rue J. Bounin,Sud,Croix d'Argent,Montpellier,Non,3M,0.0,Non,2. Acc. de voiries,49.0,Non
MNTP_000736,Ilot Avenue d'Occitanie,19920615.0,Avenue d'Occitanie,Nord-Ouest,Hôpitaux - Facultés,Montpellier,Non,3M,0.0,Non,2. Acc. de voiries,0.0,Non
MNTP_000025,Square Dominique Bagouet,19740101.0,Place Saint-Roch,Centre,Écusson,Montpellier,Non,Commune,2.0,Non,1. Parcs et squares,0.0,Oui
MNTP_002530,Domaine de Grammont - Parking du cimetière,20220101.0,Rue Richard Wright,Est,Grammont,Montpellier,Non,3M,0.0,Non,2. Acc. de voiries,22.0,Non
MNTP_000755,Ilot Rue Esculape,19940713.0,Rue Esculape,Nord-Ouest,Cévennes,Montpellier,Non,3M,0.0,Non,2. Acc. de voiries,0.0,Non
MNTP_001252,École primaire André Malraux,20170501.0,Rue Joan Miro,Est,Port Marianne,Montpellier,Non,Commune,0.0,Non,3. Acc. de bât. et équipements publics,0.0,Non
MNTP_001296,ZAE Garosud Nord - Rue Patrice Lumumba - Ouest,20160105.0,Rue Patrice Lumumba,Sud,Croix d'Argent,Montpellier,Non,SA3M,0.0,Non,2. Acc. de voiries,9.0,Non
MNTP_001295,ZAE Garosud - Rue du Commandant Massoud,20160104.0,Rue du Commandant Massoud,Sud,Croix d'Argent,Montpellier,Non,3M,0.0,Non,2. Acc. de voiries,9.0,Non
MNTP_000442,Abords Avenue de Vanières,19900701.0,Avenue de Vanières,Sud,Croix d'Argent,Montpellier,Non,3M,0.0,Non,2. Acc. de voiries,0.0,Non
MNTP_001309,Tram Ligne 1 - Abords Avenue des Moulins,20001006.0,Avenue des Moulins,Nord-Ouest,Hôpitaux - Facultés,Montpellier,Non,3M,0.0,Non,2. Acc. de voiries,0.0,Non
MNTP_000983,Ilots Rue Proudhon,20040219.0,Rue Proudhon,Centre,Verdanson,Montpellier,Non,Commune,0.0,Non,2. Acc. de voiries,10.0,Non
MNTP_000207,École élémentaire Sigmund Freud,20240901.0,Rue des Tourterelles,Nord-Ouest,Hôpitaux - Facultés,Montpellier,Non,Commune,3.0,Non,6. Espaces verts écoles et crèches,34.0,Oui
MNTP_000437,Abords Avenue de Monsieur Teste,19900301.0,Avenue de Monsieur Teste,Nord-Ouest,Cévennes,Montpellier,Non,3M,0.0,Non,2. Acc. de voiries,0.0,Non
MNTP_000826,Abords Impasse François Chicoyneau de la Valette,19970502.0,Impasse François Chicoyneau de la Valette,Nord-Ouest,Hôpitaux - Facultés,Montpellier,Non,Commune,0.0,Non,2. Acc. de voiries,0.0,Non
MNTP_000124,Abords Place royale du Peyrou - bas,19000101.0,Place Giral,Centre,Peyrou,Montpellier,Non,Commune,0.0,Non,2. Acc. de voiries,0.0,Non
