num_dossier,nom_site,date_creasite,adresse,quartier,secteur,commune,ev_tabac,ev_proprietaire,nb_acces,ev_fermable,ev_typologie,nb_arbres,acces_pmr
MNTP_000589,Square de la Providence,19920701.0,Rue de la Providence,Centre,Écusson,Montpellier,Non,Commune,0.0,Non,1. Parcs et squares,0.0,Oui
MNTP_000273,Vieille Porte de la Blanquerie,19900101.0,Boulevard Louis Blanc,Centre,Écusson,Montpellier,Non,3M,0.0,Non,2. Acc. de voiries,0.0,Non
MNTP_000044,Place Eugène Bataillon,20240101.0,Place Eugène Bataillon,Nord-Ouest,Hôpitaux - Facultés,Montpellier,Non,3M,0.0,Non,12. Place,0.0,Non
MNTP_000935,Abords ACM Pompignane,20010101.0,"Rue Louise Michel, Rue Pierre Semard",Est,Port Marianne,Montpellier,Non,Commune,0.0,Non,4. Acc. d'habitations,0.0,Non
MNTP_000137,Rue des deux ponts,19820101.0,Rue des Deux Ponts,Centre,Antigone,Montpellier,Non,3M,0.0,Non,2. Acc. de voiries,0.0,Non
MNTP_001025,Parc de Font Colombe,20060101.0,Rue de Château Bon,Nord-Ouest,Cévennes,Montpellier,Non,Commune,2.0,Oui,1. Parcs et squares,99.0,Oui
MNTP_000148,École élémentaire Louisville,19700101.0,Avenue de Louisville,Nord-Ouest,Mosson,Montpellier,Non,Commune,2.0,Non,6. Espaces verts écoles et crèches,11.0,Oui
MNTP_000304,Square Saint-Cléophas,19880101.0,Route de Toulouse,Sud,Croix d'Argent,Montpellier,Non,3M,0.0,Non,1. Parcs et squares,4.0,Non
MNTP_000308,Domaine de Grammont - Pinède,19810101.0,Avenue Albert Einstein,Est,Grammont,Montpellier,Non,Commune,4.0,Non,9. Espaces de nature,20.0,Non
MNTP_000500,Domaine de Grammont - DNAP,19910101.0,Allée Camille Muffat,Est,Grammont,Montpellier,Non,Commune,1.0,Oui,3. Acc. de bât. et équipements publics,55.0,Oui
MNTP_001161,Abords Echangeur Avenue de la Liberté,20140903.0,Avenue de la Liberté,Nord-Ouest,Mosson,Montpellier,Non,3M,0.0,Non,2. Acc. de voiries,1.0,Non
MNTP_000066,Domaine de Grammont - Mare écologique,15500101.0,Allée Camille Muffat,Est,Grammont,Montpellier,Non,Commune,1.0,Oui,9. Espaces de nature,0.0,Non
MNTP_001213,Abords Rue Rosa Luxemburg,20160401.0,Rue Rosa Luxemburg,Sud,Croix d'Argent,Montpellier,Non,3M,0.0,Non,2. Acc. de voiries,13.0,Non
MNTP_000650,Square de l'Intendance du Languedoc,20040501.0,Rue d'Aigrefeuille,Centre,Écusson,Montpellier,Oui,Commune,1.0,Oui,1. Parcs et squares,2.0,Non
MNTP_000212,École élémentaire Paul Painlevé,19700101.0,Avenue de la Pompignane,Est,Port Marianne,Montpellier,Non,Commune,1.0,Non,6. Espaces verts écoles et crèches,5.0,Non
MNTP_002561,Abords espaces verts - Rive droite Lez,20001006.0,Boulevard des Consuls de Mer,Est,Port Marianne,Montpellier,Non,3M,0.0,Non,2. Acc. de voiries,15.0,Non
MNTP_000477,École élémentaire Louis Armstrong,20220901.0,971 Rue Paul Rimbaud,Nord-Ouest,Cévennes,Montpellier,Non,Commune,1.0,Non,6. Espaces verts écoles et crèches,1.0,Oui
MNTP_001199,Square Vaclav Havel,20150604.0,Rue Le Tintoret,Est,Port Marianne,Montpellier,Non,SA3M,4.0,Non,1. Parcs et squares,107.0,Oui
MNTP_001332,Abords Rue Gaston Bachelard,20070601.0,Rue Gaston Bachelard - Avenue de Villeneuve-Angoulème,Sud,Croix d'Argent,Montpellier,Non,3M,0.0,Non,2. Acc. de voiries,0.0,Non
MNTP_001222,Abords Rue du Mas de Perrette,20160421.0,Rue du Mas de Perrette,Nord-Ouest,Cévennes,Montpellier,Non,3M,0.0,Non,2. Acc. de voiries,9.0,Non
MNTP_001324,ZAE Garosud - Rue Jugurtha,19930101.0,Rue Jugurtha,Sud,Prés d'Arènes,Montpellier,Non,3M,0.0,Non,2. Acc. de voiries,0.0,Non
MNTP_001057,Tram Ligne 1 - Abords Avenue du Professeur Grasset,20001006.0,Avenue du Professeur Grasset,Centre,Verdanson,Montpellier,Non,3M,0.0,Non,2. Acc. de voiries,0.0,Non
MNTP_000991,Rue Agnès d'Aragon,20040615.0,Rue Agnès d'Aragon,Nord-Ouest,Hôpitaux - Facultés,Montpellier,Non,3M,0.0,Non,2. Acc. de voiries,5.0,Non
MNTP_000949,Abords Rue de l'Aiguelongue,20011113.0,Rue de l'Aiguelongue,Nord-Ouest,Hôpitaux - Facultés,Montpellier,Non,Commune,0.0,Non,2. Acc. de voiries,0.0,Non
MNTP_000815,Place des Patriotes,19960715.0,Place des Patriotes,Est,Port Marianne,Montpellier,Non,3M,4.0,Non,1. Parcs et squares,74.0,Oui
MNTP_001004,Abords Rue Serge Lifar,20050201.0,Rue Serge Lifar,Nord-Ouest,Cévennes,Montpellier,Non,3M,0.0,Non,2. Acc. de voiries,20.0,Non
MNTP_002543,Abords Rue Jules Isaac,19000101.0,Rue Jules Isaac,Est,Port Marianne,Montpellier,Non,3M,0.0,Non,2. Acc. de voiries,6.0,Non
MNTP_001176,Abords de la serre amazonienne,19630101.0,Avenue du Val de Montferrand,Nord-Ouest,Hôpitaux - Facultés,Montpellier,Non,3M,0.0,Non,3. Acc. de bât. et équipements publics,8.0,Non
MNTP_001031,Abords Rue de la Carrierasse,20050515.0,Rue de la Carrierasse,Nord-Ouest,Hôpitaux - Facultés,Montpellier,Non,3M,0.0,Non,2. Acc. de voiries,0.0,Non
MNTP_000849,Parc Malbosc,19990101.0,Rue de Malbosc,Nord-Ouest,Les Hauts de Massane,Montpellier,Non,Commune,0.0,Non,9. Espaces de nature,0.0,Non
MNTP_000010,Lac des Garrigues,19620101.0,Avenue Guilhem de Poitiers,Nord-Ouest,Les Hauts de Massane,Montpellier,Non,Commune,0.0,Non,9. Espaces de nature,0.0,En partie
MNTP_000019,Jardin du Champ de Mars,18991231.0,Allée du Deuxième Génie,Centre,Écusson,Montpellier,Non,Commune,0.0,Non,1. Parcs et squares,173.0,Oui
MNTP_000659,Jardin Richter,19940915.0,Place Christophe Colomb,Est,Port Marianne,Montpellier,Non,Commune,0.0,Non,1. Parcs et squares,22.0,Oui
MNTP_001105,Square Billie Holiday,20010101.0,Rue Billie Holiday,Nord-Ouest,Hôpitaux - Facultés,Montpellier,Non,SA3M,1.0,Oui,1. Parcs et squares,0.0,Non
MNTP_001216,ZAE Eureka,20160104.0,Rue de Thor - Rue du Walhalla - Rue d'Odin,Est,Port Marianne,Montpellier,Non,SA3M,0.0,Non,2. Acc. de voiries,69.0,Non
MNTP_000923,Abords ACM Marie-Caizergues,20010101.0,Rue Marie-Caizergues,Centre,Verdanson,Montpellier,Non,Commune,0.0,Non,4. Acc. d'habitations,0.0,Non
MNTP_000043,Abords Avenue Augustin Fliche,19700101.0,Avenue Augustin Fliche,Nord-Ouest,Hôpitaux - Facultés,Montpellier,Non,3M,0.0,Non,2. Acc. de voiries,51.0,Non
MNTP_000042,Rond-point Place Eugène Bataillon,19700101.0,Place Eugène Bataillon,Nord-Ouest,Hôpitaux - Facultés,Montpellier,Non,3M,0.0,Non,2. Acc. de voiries,0.0,Non
MNTP_001347,Abords Avenue de la Pompignane,20240101.0,Avenue de la Pompignane,Est,Port Marianne,Montpellier,Non,3M,0.0,Non,2. Acc. de voiries,10.0,Non
MNTP_000928,Abords ACM Val de Croze-Bagatelle,20010101.0,Rues Rouget de Lisle - A. de Sousa Mendès - Cheng Du,Sud,Croix d'Argent,Montpellier,Non,Commune,0.0,Non,4. Acc. d'habitations,62.0,Non
MNTP_000015,Bois de Montmaur,19100101.0,Rue Arthur Young,Nord-Ouest,Hôpitaux - Facultés,Montpellier,Oui,Commune,5.0,Oui,9. Espaces de nature,0.0,En partie
MNTP_000853,Square Vedel,19980706.0,Rue Hippolyte Fizeau,Est,Port Marianne,Montpellier,Non,Commune,1.0,Oui,1. Parcs et squares,20.0,Oui
MNTP_002560,Abords Rue Euclide,20201231.0,Rue Euclide,Est,Port Marianne,Montpellier,Non,SA3M,0.0,Non,2. Acc. de voiries,0.0,Non
MNTP_000001,Esplanade Paul Valéry,19840101.0,Rue Hébert,Sud,Croix d'Argent,Montpellier,Non,Commune,0.0,Non,12. Place,84.0,Oui
MNTP_001219,Coulée verte Avitarelle,20160223.0,Rue du Docteur Fourcade,Sud,Prés d'Arènes,Montpellier,Non,Commune,0.0,Non,4. Acc. d'habitations,0.0,Non
MNTP_001121,École primaire Olympe de Gouges,20100901.0,1371 Rue de Bugarel,Sud,Croix d'Argent,Montpellier,Non,Commune,2.0,Non,6. Espaces verts écoles et crèches,8.0,Oui
MNTP_000005,Berges du Lez - Promenades basses,19850101.0,Avenue de la mer,Est,Port Marianne,Montpellier,Non,Commune,0.0,Non,1. Parcs et squares,5.0,Oui
MNTP_000813,Halte-garderie Villeneuve d'Angoulême,19960615.0,Rue Fernandel,Sud,Croix d'Argent,Montpellier,Non,Commune,1.0,Non,6. Espaces verts écoles et crèches,4.0,Non
MNTP_001202,Abords Rue de la Laïcité,20150812.0,Rue de la Laïcité,Sud,Prés d'Arènes,Montpellier,Non,3M,0.0,Non,2. Acc. de voiries,9.0,Non
MNTP_000250,Square de la piscine Mosson,19760101.0,Avenue de Heidelberg,Nord-Ouest,Mosson,Montpellier,Non,3M,0.0,Non,2. Acc. de voiries,37.0,Non
MNTP_001207,Rue de Cholet,20160101.0,Rue de Cholet,Sud,Croix d'Argent,Montpellier,Non,3M,0.0,Non,2. Acc. de voiries,9.0,Non
MNTP_000192,Abords Avenue des États du Languedoc,19820101.0,Avenue des États du Languedoc,Centre,Antigone,Montpellier,Non,Commune,0.0,Non,2. Acc. de voiries,5.0,Non
MNTP_001208,Abords Rue Émile Julien,20160101.0,Rue Émile Julien,Sud,Croix d'Argent,Montpellier,Non,3M,0.0,Non,2. Acc. de voiries,0.0,Non
MNTP_001335,Abord Rue des All Blacks,20100901.0,Rue des All Blacks,Sud,Croix d'Argent,Montpellier,Non,Commune,0.0,Non,2. Acc. de voiries,0.0,Non
MNTP_001155,Parc d'Arménie - Bassin de rétention Plantations,20120614.0,Rue des Acconiers,Sud,Prés d'Arènes,Montpellier,Non,Commune,2.0,Non,1. Parcs et squares,0.0,Oui
MNTP_000247,Square Pierre Cardenal,19720101.0,Rue Pierre Cardenal,Nord-Ouest,Les Hauts de Massane,Montpellier,Non,3M,0.0,Non,2. Acc. de voiries,0.0,Non
MNTP_000370,Ilot Place de la brigade légère,19900101.0,Avenue de la Justice de Castelnau,Centre,Verdanson,Montpellier,Non,3M,0.0,Non,2. Acc. de voiries,0.0,Non
MNTP_002549,Abords Allée Bonnier la Mosson,20240516.0,Allée bonnier la Mosson,Nord-Ouest,Mosson,Montpellier,Non,3M,0.0,Non,2. Acc. de voiries,9.0,Non
MNTP_000096,Place Albert 1er,19820101.0,Place Albert 1er,Centre,Verdanson,Montpellier,Non,3M,0.0,Non,2. Acc. de voiries,2.0,Non
MNTP_000416,École élémentaire Georges Simenon,19700101.0,Rue Émile Chartier dit Alain,Sud,Croix d'Argent,Montpellier,Non,Commune,2.0,Non,6. Espaces verts écoles et crèches,17.0,Oui
MNTP_001241,Place de la Sénéchaussée de Beaucaire,19000101.0,Place de la Sénéchaussée de Beaucaire,Nord-Ouest,Les Hauts de Massane,Montpellier,Non,3M,0.0,Non,2. Acc. de voiries,2.0,Non
MNTP_001140,Squares Alexandre Brongniart ,20121108.0,Avenue Achille Duchène,Nord-Ouest,Les Hauts de Massane,Montpellier,Non,3M,0.0,Non,1. Parcs et squares,45.0,Oui
MNTP_000415,École maternelle Robert Surcouf,19700101.0,215 Boulevard Pédro de Luna,Sud,Croix d'Argent,Montpellier,Non,Commune,2.0,Non,6. Espaces verts écoles et crèches,17.0,Oui
MNTP_001111,Aqueduc de la Lyre,20101025.0,Rue de la Croix de Lavit,Nord-Ouest,Hôpitaux - Facultés,Montpellier,Non,Commune,2.0,Non,9. Espaces de nature,0.0,En partie
MNTP_000424,École maternelle Jean de La Fontaine,19700101.0,Quai des Tanneurs,Centre,Verdanson,Montpellier,Non,Commune,1.0,Non,6. Espaces verts écoles et crèches,0.0,Oui
MNTP_000724,Square Ferdinand de Lesseps,19950215.0,Rue Ferdinand de Lesseps,Sud,Prés d'Arènes,Montpellier,Non,Commune,2.0,Oui,1. Parcs et squares,25.0,Non
MNTP_001259,Parc du Mas Nègre,20180920.0,Rue Jacques Fouroux - Rue William Webb Ellis,Sud,Croix d'Argent,Montpellier,Non,Commune,0.0,Non,1. Parcs et squares,48.0,Oui
MNTP_000575,Square Fabre de Morlhon,19910101.0,Boulevard Jacques Fabre de Morlhon,Sud,Prés d'Arènes,Montpellier,Non,Commune,2.0,Non,1. Parcs et squares,19.0,En partie
MNTP_000435,Square Rue des Castors,19900101.0,Rue des Castors,Centre,Verdanson,Montpellier,Non,Commune,1.0,Non,1. Parcs et squares,0.0,Non
MNTP_000245,Abords parking Rue Arnault Peyre,19720101.0,Rue Arnault Peyre,Nord-Ouest,Les Hauts de Massane,Montpellier,Non,3M,0.0,Non,2. Acc. de voiries,1.0,Non
MNTP_000117,Abords Avenue de la Liberté - Est,19870101.0,Avenue de la Liberté,Sud,Croix d'Argent,Montpellier,Non,3M,0.0,Non,2. Acc. de voiries,0.0,Non
MNTP_001198,Crèche Cambon,20150505.0,Place Georges Frêche,Sud,Prés d'Arènes,Montpellier,Non,Commune,1.0,Oui,6. Espaces verts écoles et crèches,5.0,Oui
MNTP_000647,Abords parking Rue André Le Nôtre,19000101.0,Rue André Le Nôtre,Nord-Ouest,Mosson,Montpellier,Non,Commune,0.0,Non,2. Acc. de voiries,0.0,Oui
MNTP_000413,École primaire Ludwig-Van-Beethoven,19870101.0,280 Rue du Mas Nouguier,Sud,Croix d'Argent,Montpellier,Non,Commune,2.0,Non,6. Espaces verts écoles et crèches,15.0,Oui
MNTP_000173,École maternelle James Joyce,19700101.0,Rue de Bologne,Nord-Ouest,Les Hauts de Massane,Montpellier,Non,Commune,2.0,Non,6. Espaces verts écoles et crèches,0.0,Oui
MNTP_000821,Couverture ruisseau des Aiguerelles,19750101.0,Boulevard d'Orient,Sud,Prés d'Arènes,Montpellier,Non,3M,0.0,Non,9. Espaces de nature,20.0,Non
MNTP_001255,Ilot Rue des Renoncules,19000101.0,Rue des Renoncules,Nord-Ouest,Cévennes,Montpellier,Non,3M,0.0,Non,2. Acc. de voiries,2.0,Non
MNTP_000058,Pelouse Pic Saint-Loup,19780101.0,Avenue d'heidelberg,Nord-Ouest,Mosson,Montpellier,Non,Commune,0.0,Non,4. Acc. d'habitations,0.0,Non
MNTP_000932,Abords ACM Aiguelongue 1,20010101.0,Rue de Montasinos,Nord-Ouest,Hôpitaux - Facultés,Montpellier,Non,Commune,0.0,Non,4. Acc. d'habitations,37.0,Non
MNTP_000645,Abords Rue François d'Orbay,19910601.0,Rue François d'Orbay,Nord-Ouest,Mosson,Montpellier,Non,Commune,0.0,Non,4. Acc. d'habitations,27.0,Non
MNTP_000365,École primaire Victor Schoelcher,19700101.0,65 Rue Robespierre,Sud,Croix d'Argent,Montpellier,Non,Commune,2.0,Non,6. Espaces verts écoles et crèches,16.0,Oui
MNTP_000052,Square des Brusses,19650101.0,Rue du Dauphiné,Nord-Ouest,Hôpitaux - Facultés,Montpellier,Non,Commune,0.0,Non,1. Parcs et squares,31.0,En partie
MNTP_000199,Place du Millénaire,19860101.0,Place du Millénaire,Centre,Antigone,Montpellier,Non,Commune,0.0,Non,4. Acc. d'habitations,120.0,Oui
MNTP_000039,Square Pierre Causse,19740101.0,Rue Pierre Causse,Nord-Ouest,Cévennes,Montpellier,Non,Commune,0.0,Non,1. Parcs et squares,19.0,Oui
MNTP_000967,Parc Emmanuel Roblès,19540301.0,Rue de la République,Centre,Écusson,Montpellier,Non,Commune,2.0,Oui,1. Parcs et squares,60.0,Oui
MNTP_000257,Abords Maison Pour Tous Villon,19920131.0,Rue des Araucarias,Nord-Ouest,Cévennes,Montpellier,Non,Commune,4.0,Non,6. Espaces verts écoles et crèches,0.0,Oui
MNTP_000300,Square des Beaux Arts,18500101.0,Rue du Marché aux Bestiaux,Centre,Verdanson,Montpellier,Non,Commune,2.0,Oui,1. Parcs et squares,13.0,Oui
MNTP_000082,Place Renaudel,19870101.0,Rue Marcellin Albert,Nord-Ouest,Mosson,Montpellier,Non,Commune,0.0,Non,4. Acc. d'habitations,0.0,Non
MNTP_000264,Abords Avenue du Professeur Louis Ravas,19880101.0,Avenue du Professeur Louis Ravas,Nord-Ouest,Cévennes,Montpellier,Non,3M,0.0,Non,2. Acc. de voiries,0.0,Non
MNTP_000462,Square Louis Carles,19920301.0,Rue des Écoles,Nord-Ouest,Mosson,Montpellier,Non,Commune,0.0,Non,1. Parcs et squares,15.0,Oui
MNTP_000643,Place François Mansart,19920301.0,Place François Mansart,Nord-Ouest,Mosson,Montpellier,Non,Commune,0.0,Non,4. Acc. d'habitations,22.0,Oui
MNTP_000093,Place du Rouergue,19720101.0,Place du Rouergue,Nord-Ouest,Les Hauts de Massane,Montpellier,Non,3M,0.0,Non,2. Acc. de voiries,14.0,Non
MNTP_000461,Parc Jacques Roseau,19930901.0,Rue des Bouisses,Nord-Ouest,Cévennes,Montpellier,Non,Commune,0.0,Non,9. Espaces de nature,8.0,Non
MNTP_001936,ACM Lemasson - Rue de Ripoll,20220201.0,Rue de Ripoll,Sud,Croix d'Argent,Montpellier,Non,Commune,0.0,Non,4. Acc. d'habitations,0.0,Non
MNTP_001203,Abords Avenue du Maréchal Leclerc,20151019.0,Avenue du Maréchal Leclerc,Sud,Prés d'Arènes,Montpellier,Non,3M,0.0,Non,2. Acc. de voiries,20.0,Non
MNTP_001268,Ilots Richter,20190901.0,Rue Vendémiaire,Est,Port Marianne,Montpellier,Non,3M,0.0,Non,3. Acc. de bât. et équipements publics,0.0,Oui
MNTP_000680,Ilot Rue Jacques Bounin - Avenue de Toulouse,19930225.0,Rue Jacques Bounin - Avenue de Toulouse,Sud,Croix d'Argent,Montpellier,Non,3M,0.0,Non,2. Acc. de voiries,1.0,Non
MNTP_001061,Abords Collège Marcel Pagnol,19970101.0,Rue Topaze - Allée Aristide Briand,Sud,Croix d'Argent,Montpellier,Non,Commune,0.0,Non,3. Acc. de bât. et équipements publics,34.0,Non
MNTP_001184,Abords Boulevard Jacques Fabre de Morlhon - Est,20141121.0,Boulevard Jacques Fabre de Morlhon,Sud,Prés d'Arènes,Montpellier,Non,3M,0.0,Non,2. Acc. de voiries,0.0,Non
MNTP_000550,Abords Boulevard Jacques Fabre de Morlhon - Ouest,19900101.0,Boulevard Jacques Fabre de Morlhon,Sud,Prés d'Arènes,Montpellier,Non,3M,0.0,Non,2. Acc. de voiries,149.0,Non
MNTP_000014,Parc Rimbaud,18800101.0,Avenue Saint-André de Novigens,Centre,Verdanson,Montpellier,Non,Commune,3.0,Oui,1. Parcs et squares,145.0,Oui
MNTP_000557,Abords Rue Samuel Morse,19910201.0,Rue Samuel Morse,Est,Port Marianne,Montpellier,Non,3M,0.0,Non,2. Acc. de voiries,2.0,Non
MNTP_000865,Ruisseau Rieucoulon,19981231.0,Rue Brillat-Savarin,Nord-Ouest,Cévennes,Montpellier,Non,Commune,0.0,Non,9. Espaces de nature,0.0,Non
MNTP_000296,Ilots Avenue de Maurin,19890101.0,Avenue de Maurin,Sud,Croix d'Argent,Montpellier,Non,3M,0.0,Non,2. Acc. de voiries,3.0,Non
MNTP_001271,Abords École primaire Benoîte Groult,20190901.0,Rue de Puech Villa,Nord-Ouest,Hôpitaux - Facultés,Montpellier,Non,Commune,0.0,Non,3. Acc. de bât. et équipements publics,0.0,Non
MNTP_000175,Crèche Louise Guiraud,19910901.0,Rue de Tipasa,Nord-Ouest,Les Hauts de Massane,Montpellier,Non,Commune,2.0,Non,6. Espaces verts écoles et crèches,0.0,Oui
MNTP_001077,Rue Sainte Barbe,20080519.0,Rue Sainte Barbe,Nord-Ouest,Les Hauts de Massane,Montpellier,Non,3M,0.0,Non,2. Acc. de voiries,13.0,Non
MNTP_000468,Ilots Rue de la Spirale,19900101.0,Rue de la Spirale,Centre,Antigone,Montpellier,Non,Commune,0.0,Non,2. Acc. de voiries,1.0,Non
MNTP_000205,Ilots Rue Henri Dunant,19920130.0,Rue Henri Dunant,Centre,Verdanson,Montpellier,Non,3M,0.0,Non,2. Acc. de voiries,8.0,Non
MNTP_000054,Square et Parvis Hildevert,19840101.0,Rue Frédéric Fabrèges,Sud,Prés d'Arènes,Montpellier,Non,Commune,2.0,Oui,1. Parcs et squares,21.0,Oui
MNTP_000403,École maternelle Jean Cocteau,19000101.0,16 Rue de la Bandido,Sud,Prés d'Arènes,Montpellier,Non,Commune,2.0,Oui,6. Espaces verts écoles et crèches,12.0,Oui
MNTP_000704,Abords trésorerie générale,19750101.0,Boulevard d'Antigone,Centre,Antigone,Montpellier,Non,Commune,0.0,Non,3. Acc. de bât. et équipements publics,2.0,Non
MNTP_001095,Abord Boulevard de la Perruque,20070601.0,Boulevard de la Perruque,Sud,Prés d'Arènes,Montpellier,Non,3M,0.0,Non,2. Acc. de voiries,0.0,Non
MNTP_001073,Crèche La Petite Sirène,20070611.0,Avenue de Fès,Nord-Ouest,Hôpitaux - Facultés,Montpellier,Non,Commune,1.0,Non,6. Espaces verts écoles et crèches,4.0,Oui
MNTP_001226,Abords Églises de la Margelle,19600101.0,Avenue du Biterrois,Nord-Ouest,Les Hauts de Massane,Montpellier,Non,Commune,2.0,Non,3. Acc. de bât. et équipements publics,0.0,Oui
MNTP_000407,École maternelle Aliénor d'Aquitaine,20230901.0,Avenue de Villeneuve-Angoulème,Sud,Croix d'Argent,Montpellier,Non,Commune,2.0,Non,6. Espaces verts écoles et crèches,9.0,Oui
MNTP_001188,Rue Ferdinand Barre,20141208.0,Rue Ferdinand Barre,Sud,Croix d'Argent,Montpellier,Non,3M,0.0,Non,2. Acc. de voiries,1.0,Non
MNTP_001242,Délaissé domaine de Lavalette,20170307.0,Rue Jean-François Breton,Nord-Ouest,Hôpitaux - Facultés,Montpellier,Non,Commune,0.0,Non,2. Acc. de voiries,0.0,Non
MNTP_000282,Rond-point de la Martelle,19890101.0,Rue Viollet le Duc,Nord-Ouest,Cévennes,Montpellier,Non,3M,0.0,Non,2. Acc. de voiries,5.0,Non
MNTP_000355,Abords parking Médiathèque Garcia Lorca,19700101.0,Avenue de Palavas,Sud,Prés d'Arènes,Montpellier,Non,3M,2.0,Oui,3. Acc. de bât. et équipements publics,16.0,Oui
MNTP_000292,Abords et Rond-point de Saporta,19870101.0,Rond-Point de Saporta,Sud,Prés d'Arènes,Montpellier,Non,3M,0.0,Non,2. Acc. de voiries,16.0,Non
MNTP_000926,Abords ACM Métairie de Saysset,20010101.0,Rue Noël et André Aversenq - Rue Roger de Mirepoix,Sud,Prés d'Arènes,Montpellier,Non,Commune,0.0,Non,4. Acc. d'habitations,0.0,Non
MNTP_000129,Rond-point Tournezy,19890101.0,Rue de Montels-Église,Sud,Prés d'Arènes,Montpellier,Non,3M,0.0,Non,2. Acc. de voiries,26.0,Non
MNTP_000029,Square de la Tour des Pins,18860129.0,12 Boulevard Henri IV,Centre,Écusson,Montpellier,Non,Commune,3.0,Oui,1. Parcs et squares,17.0,Oui
MNTP_000792,Parc du Mas Vanneau,17500101.0,Avenue du Professeur Louis Ravas,Nord-Ouest,Cévennes,Montpellier,Non,Commune,0.0,Non,1. Parcs et squares,14.0,En partie
MNTP_000883,Ilot Rue Paul Rimbaud,19990915.0,Rue Paul Rimbaud,Nord-Ouest,Cévennes,Montpellier,Non,3M,0.0,Non,2. Acc. de voiries,0.0,Non
MNTP_000187,Ilot Rue des Fraisiers,19780101.0,Rue des Fraisiers,Nord-Ouest,Cévennes,Montpellier,Non,3M,0.0,Non,2. Acc. de voiries,0.0,Non
MNTP_001300,Jardinière Rue des Acconiers,20170101.0,Rue des Acconiers,Sud,Prés d'Arènes,Montpellier,Non,3M,0.0,Non,4. Acc. d'habitations,0.0,Non
MNTP_001336,Abords Chemin de Moularès,19000101.0,Chemin de Moularès,Sud,Prés d'Arènes,Montpellier,Non,3M,0.0,Non,2. Acc. de voiries,0.0,Non
MNTP_000299,Abords Maison Pour Tous Boris Vian,19000101.0,Rue de l'Améthyste,Sud,Prés d'Arènes,Montpellier,Non,Commune,3.0,Oui,3. Acc. de bât. et équipements publics,8.0,Non
MNTP_001151,Berges de la Mosson - Aval,20131212.0,Rue de Bionne,Nord-Ouest,Cévennes,Montpellier,Non,Commune,0.0,Non,9. Espaces de nature,0.0,Non
MNTP_001141,Rond-point du Château d'O,20141215.0,Avenue des Moulins,Nord-Ouest,Hôpitaux - Facultés,Montpellier,Non,3M,0.0,Non,2. Acc. de voiries,0.0,Non
MNTP_000476,Espace des Pertuisanes,19890101.0,Avenue Henri Frenay,Centre,Antigone,Montpellier,Non,Commune,0.0,Non,3. Acc. de bât. et équipements publics,12.0,Oui
MNTP_000397,Abords Rue de l'Origan,19900101.0,Rue de l'Origan,Sud,Prés d'Arènes,Montpellier,Non,3M,0.0,Non,2. Acc. de voiries,13.0,Non
MNTP_001054,Tram Ligne 1 - Abords Avenue Saint-Charles,20001006.0,Avenue Saint-Charles,Centre,Verdanson,Montpellier,Non,3M,0.0,Non,2. Acc. de voiries,0.0,Non
MNTP_001053,Tram Ligne 1 - Abords Allée de la Citadelle,20001006.0,Allée de la Citadelle,Centre,Antigone,Montpellier,Non,3M,0.0,Non,2. Acc. de voiries,0.0,Non
MNTP_001262,Colline de Las Rebes,19920727.0,Rue des Eucalyptus,Nord-Ouest,Cévennes,Montpellier,Non,3M,0.0,Non,1. Parcs et squares,0.0,Non
MNTP_000992,Abords Rue de Valencia,20040823.0,Rue de Valencia,Nord-Ouest,Cévennes,Montpellier,Non,3M,0.0,Non,2. Acc. de voiries,0.0,Non
MNTP_000230,Abords Avenue de l'Europe,19880101.0,Avenue de l'Europe,Nord-Ouest,Les Hauts de Massane,Montpellier,Non,3M,0.0,Non,2. Acc. de voiries,0.0,Non
MNTP_001341,Tram Ligne 2 - Abords Rue de la Fontaine du Pila Saint-Gély,20070601.0,Rue de la Fontaine du Pila Saint-Gély,Centre,Verdanson,Montpellier,Non,3M,0.0,Non,2. Acc. de voiries,0.0,Non
MNTP_001339,Tram Ligne 2 - Abords La Joia,20070601.0,Rue Beau Séjour,Centre,Verdanson,Montpellier,Non,SA3M,0.0,Non,2. Acc. de voiries,0.0,Non
MNTP_001337,Tram Ligne 2 - Abords Viaduc Alphonse Loubat,20070601.0,Viaduc Alphonse Loubat,Centre,Verdanson,Montpellier,Non,3M,0.0,Non,2. Acc. de voiries,0.0,Non
MNTP_000091,Rond-point Jules Ventre,19850101.0,Rond-Point Jules Ventre,Centre,Verdanson,Montpellier,Non,3M,0.0,Non,2. Acc. de voiries,5.0,Non
MNTP_000158,École maternelle Pablo Picasso,19920130.0,Avenue Guilhem de Poitiers,Nord-Ouest,Les Hauts de Massane,Montpellier,Non,Commune,3.0,Non,6. Espaces verts écoles et crèches,15.0,Oui
MNTP_001058,Tram Ligne 1 - Abords Place Marcel Godechot,20001006.0,Place Marcel Godechot,Centre,Verdanson,Montpellier,Non,3M,0.0,Non,2. Acc. de voiries,0.0,Non
MNTP_000867,Place Jacques Brel,19990606.0,Place Jacques Brel,Nord-Ouest,Les Hauts de Massane,Montpellier,Non,Commune,0.0,Non,2. Acc. de voiries,22.0,Non
MNTP_000681,Abords Rue des Fourbisseurs,19930201.0,Rue des Fourbisseurs,Sud,Croix d'Argent,Montpellier,Non,3M,0.0,Non,2. Acc. de voiries,1.0,Non
MNTP_000177,Ilot Rue Boussinesq,19670101.0,Rue Boussinesq,Centre,Peyrou,Montpellier,Non,Commune,0.0,Non,2. Acc. de voiries,0.0,Non
MNTP_001086,Abords Rue Michel de l'Hospital,20050501.0,Rue Michel de l'Hospital,Centre,Antigone,Montpellier,Non,Commune,0.0,Non,2. Acc. de voiries,0.0,Non
MNTP_000830,Place Gaby Morlay,19961211.0,Place Gaby Morlay,Nord-Ouest,Cévennes,Montpellier,Non,3M,0.0,Non,2. Acc. de voiries,0.0,Non
MNTP_000353,École élémentaire Simon Bolivar,19700101.0,Avenue de Barcelone,Nord-Ouest,Mosson,Montpellier,Non,Commune,2.0,Non,6. Espaces verts écoles et crèches,4.0,Oui
MNTP_001331,Abords Pont Bertrand Garipuy,20070601.0,Pont Bertrand Garipuy,Sud,Croix d'Argent,Montpellier,Non,3M,0.0,Non,2. Acc. de voiries,20.0,Non
MNTP_000079,Jardin de la Canourgue,16500101.0,Rue Sainte-Croix,Centre,Écusson,Montpellier,Non,3M,0.0,Non,1. Parcs et squares,18.0,Oui
MNTP_001042,Tram Ligne 1 - Abords Avenue de Barcelone,20001006.0,Avenue de Barcelone,Nord-Ouest,Mosson,Montpellier,Non,3M,0.0,Non,2. Acc. de voiries,0.0,Non
MNTP_000544,Abords Allée de la Pinède,19600101.0,Allée de la Pinède,Nord-Ouest,Les Hauts de Massane,Montpellier,Non,Commune,0.0,Non,1. Parcs et squares,48.0,Non
MNTP_000481,École élémentaire Jules Ferry,19700101.0,Rue Antoine-Laurent Jussieu,Nord-Ouest,Hôpitaux - Facultés,Montpellier,Non,Commune,2.0,Non,6. Espaces verts écoles et crèches,9.0,Oui
MNTP_000047,Square François Dezeuze,19600101.0,Rue François Dezeuze,Nord-Ouest,Cévennes,Montpellier,Non,Commune,2.0,Oui,1. Parcs et squares,15.0,Oui
MNTP_000626,Parc la Carriera,19920215.0,Rue Louis Pergaud,Nord-Ouest,Les Hauts de Massane,Montpellier,Non,Commune,7.0,Non,1. Parcs et squares,0.0,Oui
MNTP_000536,Parc Rachel,17500101.0,Impasse Villehardouin,Nord-Ouest,Hôpitaux - Facultés,Montpellier,Non,Commune,2.0,Oui,1. Parcs et squares,24.0,En partie
MNTP_001279,Parc Suzanne Babut,20220101.0,Rue Lakanal,Centre,Verdanson,Montpellier,Non,Autre,2.0,Oui,1. Parcs et squares,0.0,Oui
MNTP_000845,Abords Avenue du Mondial 98 - Ouest,19980331.0,Avenue du Mondial 98,Est,Port Marianne,Montpellier,Non,3M,0.0,Non,2. Acc. de voiries,216.0,Non
MNTP_000208,École élémentaire Docteur Calmette,19700101.0,Rue des Quatre Seigneurs,Nord-Ouest,Hôpitaux - Facultés,Montpellier,Non,Commune,2.0,Non,6. Espaces verts écoles et crèches,69.0,Oui
MNTP_000031,Mail Alain Bashung,19840101.0,Avenue du Maréchal Leclerc,Sud,Prés d'Arènes,Montpellier,Non,Commune,3.0,Oui,1. Parcs et squares,70.0,En partie
MNTP_000055,Ilot Les Clolus 1,19630101.0,Rue des Alpilles,Nord-Ouest,Hôpitaux - Facultés,Montpellier,Non,3M,0.0,Non,2. Acc. de voiries,3.0,Non
MNTP_000218,Ilot Rue de la Roqueturière,19880101.0,Rue de la Roqueturière,Nord-Ouest,Hôpitaux - Facultés,Montpellier,Non,3M,0.0,Non,2. Acc. de voiries,0.0,Non
